{
  "spec_version": "0.2.0",
  "model_id": "company-homepage-content",
  "model_version": "0.1.0",
  "name": "회사 홈페이지 콘텐츠 모델",
  "description": "profile, navigation, content, media, routes와 발행 동작을 정의하는 재사용 데이터 계약입니다.",
  "site_profile": {
    "fields": {
      "displayName": {
        "type": "string",
        "required": true,
        "minLength": 1
      },
      "tagline": {
        "type": "string",
        "required": true,
        "minLength": 1
      },
      "about": {
        "type": "string",
        "required": true,
        "minLength": 1
      },
      "logo": {
        "type": "public-url-path",
        "required": false,
        "root": "public/"
      },
      "seoDescription": {
        "type": "string",
        "required": false,
        "maxLength": 300
      },
      "shareImage": {
        "type": "public-url-path",
        "required": false,
        "root": "public/"
      },
      "favicon": {
        "type": "public-url-path",
        "required": false,
        "root": "public/"
      },
      "searchEngineIndexing": {
        "type": "boolean",
        "required": false,
        "default": true
      }
    }
  },
  "navigation": {
    "source": "site.json",
    "minimum_items": 1,
    "identity": "stable item id; labels and paths may be edited",
    "fields": {
      "id": {
        "type": "string",
        "required": true,
        "pattern": "^[a-z0-9]+(?:-[a-z0-9]+)*$",
        "unique": true
      },
      "label": {
        "type": "string",
        "required": true,
        "minLength": 1
      },
      "path": {
        "type": "internal-url-path",
        "required": true
      }
    },
    "path_policy": "one leading slash; no external/protocol-relative URL, query, fragment, backslash, or dot segment"
  },
  "media": {
    "public_directory": "data/public/",
    "entry_directory": "images/",
    "markdown_reference": "./images/<file>",
    "relative_to_entry": true,
    "validated_format": "SVG fixture only; production format/size policy pending"
  },
  "content_types": [
    {
      "kind": "page",
      "source": "data/pages/{id}.md",
      "identity": "stable lowercase ASCII kebab-case filename stem",
      "body_format": "markdown",
      "fields": {
        "kind": {
          "type": "string",
          "required": false,
          "const": "page"
        },
        "title": {
          "type": "string",
          "required": false,
          "minLength": 1
        },
        "path": {
          "type": "internal-url-path",
          "required": false
        },
        "is_public": {
          "type": "boolean",
          "required": false,
          "default": false
        }
      },
      "public_path": "frontmatter.path or path-derived default",
      "frontmatter_policy": "optional; missing content type and identity are inferred from the source path; unknown properties are preserved and ignored by the template"
    },
    {
      "kind": "post",
      "source": "data/posts/{slug}/index.md",
      "identity": "stable lowercase ASCII kebab-case directory slug",
      "body_format": "markdown",
      "fields": {
        "kind": {
          "type": "string",
          "required": false,
          "const": "post"
        },
        "title": {
          "type": "string",
          "required": false,
          "minLength": 1,
          "description": "Optional display title; templates fall back to the first Markdown H1 and then the path-derived slug."
        },
        "description": {
          "type": "string",
          "required": false,
          "minLength": 1,
          "description": "Optional summary; omitted when absent."
        },
        "date": {
          "type": "date",
          "required": false,
          "format": "YYYY-MM-DD"
        },
        "published_at": {
          "type": "string",
          "required": false,
          "format": "ISO 8601 date-time with explicit timezone",
          "description": "Actual publication instant; BlogGenius writes this at the publication action."
        },
        "editorial_status": {
          "type": "string",
          "required": false,
          "default": "draft",
          "values": [
            "draft",
            "complete"
          ],
          "description": "Authoring completeness only; independent of publication."
        },
        "publication": {
          "type": "string",
          "required": false,
          "default": "none",
          "values": [
            "none",
            "private",
            "public"
          ],
          "description": "Deployment and listing intent: none stays local; private deploys an unlisted detail page; public deploys and lists the post."
        },
        "author": {
          "type": "string",
          "required": false,
          "minLength": 1,
          "description": "Optional creator name; templates expose it as author metadata when present."
        },
        "cover": {
          "type": "entry-relative-image",
          "required": false,
          "description": "Optional representative image relative to the post entry, typically ./images/<file>. BlogGenius selects the first embedded image automatically."
        },
        "cover_alt": {
          "type": "string",
          "required": false,
          "description": "Alternative text for the representative image, usually copied from the image block title."
        }
      },
      "listing_route": "/blog/",
      "detail_route": "/blog/{slug}/",
      "frontmatter_policy": "optional; missing content type and identity are inferred from the source path; unknown properties are preserved and ignored by the template"
    },
    {
      "kind": "service",
      "source": "data/services/{slug}/index.md",
      "identity": "stable lowercase ASCII kebab-case directory slug",
      "body_format": "markdown",
      "fields": {
        "kind": {
          "type": "string",
          "required": false,
          "const": "service"
        },
        "title": {
          "type": "string",
          "required": false,
          "minLength": 1
        },
        "description": {
          "type": "string",
          "required": false,
          "minLength": 1
        },
        "order": {
          "type": "integer",
          "required": false,
          "minimum": 0
        },
        "is_public": {
          "type": "boolean",
          "required": false,
          "default": false
        }
      },
      "listing_route": "/services/",
      "detail_route": "/services/{slug}/",
      "frontmatter_policy": "optional; missing content type and identity are inferred from the source path; unknown properties are preserved and ignored by the template"
    }
  ],
  "content_frontmatter_policy": {
    "required_fields": [],
    "path_is_identity_source": true,
    "kind_may_be_omitted_and_is_inferred_from_path": true,
    "unknown_properties": "preserve-and-ignore",
    "post_publication_default": "none",
    "post_author": "optional string; omitted unless explicitly supplied",
    "post_representative_image": "optional cover entry-relative path; BlogGenius chooses the first embedded image; templates use it for thumbnails and social preview metadata"
  }
}
